ID,author,year,language,temporal_period,n_stanzas,text,text_en
UP2160_1,Iryna Vikyrchak,2019.0,Ukrainian,2014_2021,1,"Я знаю, ти тут.
Я чула цей звук: 
випадково зустрівшись із ґудзиком металевим
дзвінко і довго клямка комоду тримала вібруюче ""соль"". 
Ти десь у цих стінах, 
в шухляді, підлозі, чи люстрі на стелі
джином безпомічним б'єшся, 
мов птаха об шибу,
мов риба об лід
в структуру твердої матерії. 
Шість тижнів минуло, 
та ти все невидима і непочута 
присутня між складками одягу в шафі,
між рядками келішків в серванті, 
що, як завжди, дзеленчать, 
коли попри дім проїжджає вантажівка. 
Шість тижнів минуло, і вчора 
протяг раптовий звіяв зі столу
старі і нові фотографії, 
і вперше було помічено 
нашу з тобою схожість.
Я знаю, ти тут.","I know, thou art here.  
I heard this sound:  
by chance encountering a metal button  
ringingly and long did the latch of the chest hold vibrating ""sol.""  
Thou art somewhere within these walls,  
in the drawer, the floor, or the chandelier upon the ceiling  
like a helpless genie dost thou struggle,  
as a bird against the pane,  
as a fish against the ice  
in the structure of solid matter.  
Six weeks have passed,  
yet thou art still unseen and unheard  
present amidst the folds of clothing in the wardrobe,  
among the lines of goblets in the sideboard,  
which, as always, do jingle,  
when a truck dost pass by the house.  
Six weeks have passed, and yesterday  
a sudden draft did blow from the table  
old and new photographs,  
and for the first time was noted  
our likeness, thou and I.  
I know, thou art here."
UP2124_1,Dmytro Lazutkin,2022.0,Ukrainian,post_2022,1,"ІНДІЙСЬКИЙ ОКЕАН
що вона робила 
на узбережжі індійського океану?
дивилася як сонце обережно 
сідає на хвилі і починає на них гойдатися?
їла солодкі фрукти під пальмами?
ганяла на моторолері? 
вигиналася мов змія 
лежачи на піску? 
курила духм’яну траву?
танцювала? медитувала? 
фотографувалася зі слонами?
напевно саме так все і було
десять днів світла
десять днів свободи…
поверталася ніна 
літаком через варшаву
під час пересадки встигла поспілкувалася по відеозв’язку з донькою
яка залишилася з її батьками 
вдома
у маріуполі
її малій було чотири роки
вона смішно вимовляла окремі слова
особливо нові для себе
наприклад говорячи про ракети
сказала:
мам
а у нас лакети
які лакети?
ну що ти там вже знову вигадуєш?","INDIAN OCEAN
What did she do
Upon the shores of the Indian Ocean?
Did she gaze as the sun cautiously
Setteth upon the waves and beginneth to sway upon them?
Did she eat sweet fruits beneath the palms?
Did she race upon a motor scooter?
Did she bend like a serpent
Lying upon the sand?
Did she smoke fragrant herbs?
Did she dance? Did she meditate?
Did she take photographs with elephants?
Surely, thus it was all
Ten days of light
Ten days of freedom...
Nina returned
By plane through Warsaw
During the layover, she managed to converse via video link with her daughter
Who remained with her parents
At home
In Mariupol.
Her little one was four years old.
She amusingly pronounced certain words,
Especially those new to her.
For instance, speaking of rockets,
She said:
""Mom,
And we have lakety.""
""What lakety?""
""Well, what dost thou invent again?"" // Thus did Nina learn of the onset of war.
Within minutes, her flight was cancelled,
As were all other flights in the needed direction.
The next day, it became clear
That henceforth, only worse would follow.
The bombardments intensified,
Reports began to appear
Of the first dead
And dreadful images of ruined high-rises.
The intervals between telephone conversations
Became unbearably long.
When she rode in a minibus
To the Ukrainian border,
The connection with her daughter and parents vanished
For seven days, as it turned out later.
Through the viscous time,
Spring crawled into the world.
The subscribers were
Out of reach.
The news that arrived—
Did hinder her from breathing.
A full siege of the city,
A full siege of the city,
And wherefore could air be found in her lungs?
She read of humanitarian corridors for civilians,
Shot by Russian soldiers.
She called the neighbors,
Inquired—when had they last seen her daughter?
She asked again through the creaking and rustling of the receiver:
""Is she alive?"" // Is she alive?
Dost thou hear me? Is she alive?
Against her little girl,
The army of Putin employed
Multiple rocket launch systems,
Long-range artillery,
Aerial bombs,
Tactical missiles,
Very many tanks,
Mortars and small arms.
Constantly:
Tremors and vibrations.
They wrote that the city was destroyed
By fifty percent,
Then—by seventy,
Later—by ninety.
An endless wasteland,
A dead earth,
To which
The birds returned as if home,
But saw—only burnt nests,
And flew away forever,
Astonished,
Horrified,
Confounded.
Nina calculated all possible variants,
And for good measure—the impossible ones.
Thus, when they called her
From an unknown number,
She was already prepared for all. // As it turned out,
One day, into their bomb shelter
Came people with automatics,
Swiftly took all away,
And carried them somewhere near Rostov.
Some were—allowed to remain temporarily in Donetsk.
It was from there that they called.
Nina listened to the unfamiliar voice and prayed in her mind.
She heard familiar ones—and wept.
She managed to arrange everything,
Almost by miracle...
She took them at the checkpoint.
Beyond the windows of the automobile, there floated
Low clouds and tall trees.
Almost the entire way, the girl
Slept in the back seat.
Already past Przemyśl,
Awakened by the brazen sun of morning,
Suddenly asked:
""Mom,
Mommy,
Tell me,
How dost thou find India?
Please,
Tell me,
How dost thou find India?""
The blurred horizon
Did consume the eyes,
When would this road
Come to an end? // We shall surely converse
Of all things."
UP2258_1,Iryna Vikyrchak,2020.0,Ukrainian,2014_2021,1,"Вірші – це коли з душевного пороху формуються скульптури зі слів. Любов і біль, що набирають форму тільки у амфорі мови.  Потужні згустки енергії, потаємна оборонна зброя, магічне закляття, терапевтичні ліки. Послання у пляшці, код, що має стільки варіацій, скільки у нього є читачів і прочитань.
Мені, мені потрібні ці лапідарні тексти-ребуси, кубики Рубіка, незрозумілі без ключа, ані по змісту, ані по формі. А може, все не так? Гаразд, я готова  читати  вголос ці вірші, непридатні до читання вголос кимсь іншим, коментувати всі ці алюзії й пояснювати незрозумілі слова. Бо життя, коротке і крихке, дозволило спробувати ще раз, але за умови цього разу не кремпуватись і ще  написати ось цей от про територію безбожжя. 
Десь прочитала, що після нещасних випадків душі загиблих потрапляють у іншу реальність, де вони цього самого випадку уникають і продовжують жити так, ніби нічого не сталося. Це все ще та сама реальність? Ущипніть мене хтось, треба терміново перевірити. 
slow-motion
уперше в житті так кричиш
та крику не чути
повітря густе й від удару гаряче
ця сцена тобі знайома, її не раз 
проживала з героями кінофільмів 
виявляється, вона насправді проходить 
в режимі slow-motion  
повільно й граційно розкриваються 
подушки безпеки й повіки – 
широко, як ніколи, бо, може, востаннє 
а може, від жаху, а може, від неминучості 
смерть заглядає в зіниці 
краплями беладонни 
повільно й граційно скло вітрове 
покривається зморшками тріщин
жодних спогадів жодних жалів 
жодного бога і ангелів 
тільки хрускіт і скрип металу і подив  - 
у мене кістки є,  хребет і суглоби
і ось саме зараз вони 
виконують свою музику - їх зоряний час - ламаючись 
усе замовкає, наступає космічна тиша – 
мить правди на теренах безбожжя
хоча, більше схоже на вічність і суд страшний,
який нІкому розсудити 
а потім з котроїсь із міфологій","Verses are when from the dust of the soul sculpted forms of words dost take shape. Love and pain, which dost assume form only in the amphora of language. Mighty clumps of energy, secret defensive weaponry, magical incantation, therapeutic remedies. A message in a bottle, a code that hath as many variations as there be readers and readings thereof. I, I dost need these lapidary texts-rebus, Rubik's cubes, incomprehensible without a key, neither by content nor by form. Or mayhap, all is not so? Well, I am ready to read aloud these verses, unfit for reading aloud by another, to comment upon all these allusions and to explain the incomprehensible words. For life, short and fragile, hath allowed to try once more, but on the condition this time not to falter and to write yet this about the territory of godlessness. Somewhere I did read that after misfortunes the souls of the slain dost enter another reality, where they dost avoid that very misfortune and continue to live as if naught hath happened. Is this still the same reality? Pinch me, someone, I must urgently verify. slow-motion for the first time in life dost thou scream thus and the scream is not heard the air is thick and hot from the blow this scene is familiar to thee, thou hast lived it many times with the heroes of films it appears, it dost truly unfold in slow-motion slowly and gracefully dost unfold the airbags and eyelids – widely, as never before, for, mayhap, for the last time or mayhap, from horror, or mayhap, from inevitability death dost gaze into the pupils with drops of belladonna slowly and gracefully the windscreen dost cover with wrinkles of cracks no memories, no regrets no god nor angels only the crunch and creak of metal and wonder - I have bones, a spine and joints and lo, at this very moment they dost perform their music - their starry hour - breaking all dost fall silent, cosmic silence dost descend - a moment of truth in the lands of godlessness although, more akin to eternity and a dreadful judgment, which no one can adjudicate and then from some mythology or other. // (to be well acquainted with religions in such situations shall be of use: the more religions, the more chances to call unto someone, after all) and then from some mythology dost appear a Roman godling, the vagitant first to arrive at the scene dost open thy mouth, newly born, and dost place within it the gift of speech and dost say: here, take, this is thy yet another chance a heap of scrap – a new maternal womb light above thee – dost thou see? and a hand of aid, which dost receive the birth shall accept thee into this world as well come now"
UP2279_1,Dmytro Lazutkin,2022.0,Ukrainian,post_2022,1,"я був закоханий у вчительку
писав їй вірші про любов
коли вона мене вичитувала
я себе голкою вколов
і легше було не торкатися
летіти вітром поміж трав
вона  питала про сервантеса 
а я сосюру цитував
я був дурним як всі закохані
я свято вірив у дива
метелик тріпотів  у коконі 
я в зошиті писав слова
я уявляв її я знав її
найкраще ніж вона сама
і дощик шелестів по гравію
і не приходила зима….","I was enamored of mine teacher,
I wrote to her verses of love.
When she did read me, I pricked myself with a needle,
And it was easier not to touch.
To fly like the wind amidst the grass.
She did ask of Cervantes,
And I did quote Sosyura.
I was foolish as all who are in love,
I did truly believe in miracles.
A butterfly did flutter in its cocoon,
I did write words in mine notebook.
I did imagine her, I did know her,
Better than she herself did know.
And the rain did rustle upon the gravel,
And winter did not come..."
UP2294_1,Oles Ilchenko,2017.0,Ukrainian,2014_2021,1,"***
зачини вікно
тримай шибки 
солов’ї співають
це банально
просто безглуздо
після всього проминулого 
і читаного
замикай двері
пий чай
сповідуйся витовченим подушкам
згадуй небаченого метелика
потім
витримуй облогу ночі
невидимі дерева плачуть 
шемрають 
лопотять
аїр тріпотить мусульманським листям
місяць сіє дурман сновидінь
хмари хапають молодика за поли
на ранок лише 
тьмяне тіло миші
у склянці з олією","Shut thou the window,
Hold fast the panes;
The nightingales do sing.
'Tis banal,
Merely senseless,
After all that hath passed
And hath been read.
Lock thou the doors,
Drink tea,
Confess unto the worn pillows;
Recall the unseen butterfly.
Then,
Endure the siege of night;
The invisible trees do weep,
Whispering,
Rustling.
The sweet flag doth flutter with Muslim leaves;
The moon doth sow the intoxication of dreams.
The clouds do seize the young moon by its hem;
On the morrow, only
The dim body of a mouse
In a glass of oil."
UP2296_1,Iryna Vikyrchak,2020.0,Ukrainian,2014_2021,1,"джоґґінґ 
прокидаюсь у собі
в кімнаті в квартирі 
ні світ ні зоря 
виходжу в це місто й 
чіпляюсь за Одру, 
як бісер на нитку нанизую 
на неї внутрішню навігацію
вовком скрадаюсь вздовж берега 
ні світ ні зоря
бетонованою набережною
де й запахів
не вловити
тільки течію 
нанизую петлі кругом островів 
петля на петлю
вовняне тепле плетиво 
хоча може лише 
кучерява овеча шкура
а серце круком попереду і вгорі 
вмру, як не наздожену
#альгометрія","jogging
I dost awaken within myself
in the chamber of the flat
neither light nor star
I go forth into this city and
I cling to the Odra,
as beads upon a thread I dost string
upon her the inner navigation
like a wolf I dost creep along the shore
neither light nor star
on the concreted embankment
wherein the scents
cannot be caught
only the current
I dost string loops around the islands
loop upon loop
a woolly warm weave
though mayhap it be only
a curly sheep's skin
and my heart dost race ahead and above
I shall die, if I dost not catch up"
UP2408_1,Kateryna Babkina,2022.0,Ukrainian,post_2022,1,"Люблю в цей день нагадувати вам,
що якщо ваш столик - не на двох;
якщо в вас немає другої половинки - ще чи вже, 
чи тому що ви самі собі 130%, 
або тому що в вас є дві третинки, три четвертинки, чи просто іноді по 0,15;
якщо вам ніхто не несе сьогодні сердечко, і ви нікому -
то це ок. 
З вами все так.
В вас все як слід.
Єдина людина, яка не може вас не любити, це ви самі. Любіть, як умієте, і як саме вам підходить.
Кожен день для цього хороший, не лише сьогодні.
♥️","I do love to remind thee on this day,
That if thy table be not set for two;
If thou hast not a second half, yet or already,
Or because thou art thine own 130%,
Or because thou hast two thirds, three quarters, or simply sometimes 0.15;
If no one doth bring thee a heart today, and thou bringest none to anyone -
Then it is well.
With thee all is thus.
In thee all is as it should be.
The only person who cannot but love thee is thou thyself. Love as thou art able, and as it suits thee best.
Each day is good for this, not merely today.
♥️"
UP2449_1,Iya Kiva,2014.0,Ukrainian,2014_2021,1,"Всі ці численні «ми» та «вони»
Схожі на доісторичних істот,
Людей більше немає,
Імен немає,
Є лише займенники,
Невиразні займенники у множині,
Що пропагують смерть особистості,
Смерть однини,
Смерть одиниці,
Це ніби чути первісні колискові,
Звук випадний
поміж «и» та «и»,
Не розуміти приголосних,
Голосних вчити тваринну мову
В якості другої іноземної,
Модус вівенді простий:
Думки зачинити в навушники,
«Я не такий»
В сни вмонтувати,
Уникати рефренів,
Фейсбуків, мереж,
Меж, за якими смердюча луска,
Парою з рота писати на склі:
«Ми не риби, риби німі».
20/12/14","All these numerous 'we' and 'they'  
Resemble prehistoric creatures,  
Humans are no more,  
Names are no more,  
There art but pronouns,  
Vague pronouns in the plural,  
That do propagate the death of personality,  
The death of the singular,  
The death of the unit,  
'Tis as if to hear the primal lullabies,  
The sound accidental  
Amidst 'and' and 'and',  
To not understand the consonants,  
To teach the vowels the animal tongue  
As a second foreign language,  
The modus vivendi simple:  
To shut thoughts in headphones,  
'I am not such',  
To embed in dreams,  
To avoid refrains,  
Facebooks, networks,  
Boundaries, beyond which the stinking scales,  
To write with steam from the mouth upon the glass:  
'We are not fish, fish are mute.'"
UP2484_2,Iryna Shuvalova,2021.0,Ukrainian,2014_2021,1,"#шуваловірші
Art: Otto Marseus van Schrieck, 'Still Life with Snakes, Frogs, Mushrooms, Flowers and Butterflies'.
Нарешті осінь - і гооотика! 🙂","At last, autumn hath come - and gothic it is! 🙂"
UP2505_1,Iryna Shuvalova,2021.0,Ukrainian,2014_2021,1,"я забула
як у домі буває світло від снігу
наче десьде сліпучий янгол пройшов крізь кригу
розтопив її товщу собою повстав з ріки
вбраний в тіло зі світла і в грудях зірки зірки
так пройшов він крізь місиво міста війну відлигу
увійшов у мій дім став при ліжку торкнувсь руки
і стоїть посміхаючись мовчки
леткий як пісня
оберемок шумливих крил променистий вісник
що тримає вістку як гілку в тонких перстах
і танцює так само як білий вогонь на гілці
невимовне слово у янгола на вустах
так у дім увіходить сніг і нічні дерева
так гривасті сонця борюкаються як леви
біля босих і трохи змерзлих дитячих ніг
так у світі між бруду й болю стається диво
крізь опону небес прозирає зоря мінлива
і вогонь негасимий світить в руках моїх
———————————————————————————
#шуваловірші","I hath forgotten
how in the house doth light from snow appear,
as if somewhere a blinding angel hath passed through the ice,
melted its thickness with himself, arisen from the river,
clad in a body of light and in his breast stars, stars.
Thus he hath passed through the mishmash of the city, the war, the thaw,
entered into my house, stood by the bed, touched my hand,
and he standeth smiling silently,
light as a song,
a bundle of noisy wings, a radiant messenger,
that holdeth tidings as a branch in delicate fingers,
and danceth just as a white fire upon a bough.
An unspeakable word upon the angel's lips.
Thus doth snow enter the house and the night trees,
thus do the maned suns wrestle like lions
by the bare and somewhat frozen children's feet.
Thus in the world, amidst the filth and pain, a miracle doth occur,
through the veil of heaven doth a changing star peer,
and an unquenchable fire shineth in my hands."
UP2559_1,Artur Dron,2020.0,Ukrainian,2014_2021,5,"* * *
Перед тим, як розтане сніг.
Діставай перепустку і ключі.
Зрештою, все, що я міг,
написав тобі вчора вночі.

Перед тим, як він знову розтане.
У церкві сьогодні закрито.
Якщо тобі страшно стане,
не бійся мене розбудити.

Бо тут небезпечні заправки.
Тут кусаються тротуари.
І знов молоді аспірантки
утомлено йдуть на пари,

аби довго плакати вечорами
над серцем німим і розбитим.
Що б не було між нами.
Не бійся. Мене. Розбудити.

Сонце стало сьогодні стриманим.
Дим у шкіру і в губи в'ївся.
Не бійся і розбуди мене.
Розбуди мене. І не бійся.","Ere the snow doth melt away.  Draw forth thy pass and keys.  In the end, all that I could,  I did write to thee yesternight. // Ere it doth melt again.  In the church today it is closed.  If thou dost become afraid,  fear not to wake me. // For here be dangerous gas stations.  Here the sidewalks do bite.  And again young graduate students  do wearily go to classes, // that they may weep long in the evenings  o'er a heart mute and broken.  Whatsoever be between us.  Fear not. Wake. Me.  To wake. // The sun hath become restrained today.  Smoke hath seeped into skin and lips.  Fear not and wake me.  Wake me. And fear not."
