ID,author,year,language,temporal_period,n_stanzas,text,text_en
UP703_1,Kateryna Kalytko,2022.0,Ukrainian,post_2022,7,"Вечірня шкільна екскурсія до друкарні:
лоскітний запах фарби й металу,
світло в цехах масне, 
ніби суп на ребрах,
ротаційні машини і лінотип, 
щойно протертий ганчіркою,
подзвін, з яким розсипається 
тіло тексту,
вкрадена матриця у кишені – літера S,
ніби знак нескінченності,
вони ж самі казали, що латинки
майже не використовують. 
Не віриться, але нас і справді 
хотіли навчити такої праці – 
робити вперту свинцеву кирилицю 
продовженням власних пальців,
складати шпальту актуальних новин
у ритмі, не швидшому за серцебиття набірниці.

Все забуваю спитати, чи й тебе 
писати вчили спершу чорнильною ручкою 
у зошитах з каліграфії,
котра з прописних літер давалась тобі найважче,
чи лишав ти на аркушах ляпки, аби потім
вони проступали крізь промокальний папір
силуетами, що наближаються зі снігового поля – 
і спершу незрозуміло, 
чужі прийшли чи свої.

Навички світу, який минає.

На іншій шкільній екскурсії ми побачили,
як влаштовано хлібзавод, і випадково –
як черстві, аж кам'яні буханці перемелюють,
як сухарне борошно досипають до чистого.
Авжеж, дев'яності, нікому не було діла
до космогонії українського тіста,
до нашої кризи довіри.

І тепер, щоранку, коли 
чужі й свої з усього світу 
питають: ""Ну як там? Уже почалося?"" – чую 
непідробну цікавість до репертуару
жайворонків у час,
поки кухар вивчає рецепт пирога, 
у якому їх запікатиме. 
Але на цій землі
жайворонки тільки гніздяться в житах
і співають над ними, злітаючи по спіралі,
не лягають ніколи начинкою 
у тісто чуже, котре не вміє й дихати.
Немає такої традиції.

Пояснити можливо не все.
Коли ж намагаюся – 
складаю рядки по літері, 
як операторка лінотипу.
Розставляю слова як належить – дзеркально. 
Ніби все спочатку –
абетки свинцеве борошно.
Віддрукований аркуш гарячий, як свіжий хліб.
Та щоразу, щоразу лишається біла пляма,
і щоразу, щоразу хтось перепитує,
чорнильно проступаючи силуетом
крізь папір.

Думаю, справа у вкраденій літері.
Думаю, справді в ній.
Але я її загубила.","The evening school excursion to the printing house:
the pungent scent of paint and metal,
the light in the workshops greasy,
even as soup upon ribs,
the rotary machines and linotype,
just wiped with a cloth,
the chime with which the body of text doth scatter,
the stolen matrix in pocket – the letter S,
even as the sign of infinity,
they themselves did say that Latin letters
are hardly used at all.
I cannot believe, but they truly
did wish to teach us such labor –
to make obstinate lead Cyrillic
a continuation of our own fingers,
to compose the column of current news
in a rhythm not swifter than the heartbeat of the typesetter. // I do forget to ask all, dost thou
learned to write first with a fountain pen
in notebooks of calligraphy,
which of the capital letters was hardest for thee,
didst thou leave blots upon the sheets, that later
they did appear through the blotting paper
as silhouettes approaching from the snowy field –
and at first it is unclear,
whether strangers came or thine own. // The skills of a world that doth pass away. // On another school excursion we did see,
how a bread factory is arranged, and by chance –
how stale, even stony loaves are ground,
how the rusks' flour is added to the clean.
Indeed, the nineties, no one cared
for the cosmogony of Ukrainian dough,
for our crisis of trust. // And now, each morn, when
strangers and kin from all the world
do ask: ""How is it? Hast it begun?"" – I hear
a genuine curiosity for the repertoire
of skylarks in time,
while the cook doth study the recipe for pie,
in which he shall bake them.
But on this land
the skylarks only nest in the rye
and sing above them, soaring in spiral,
do not lie ever as filling
in foreign dough, which knoweth not how to breathe.
There is no such tradition. // To explain mayhap not all.
When I do strive –
I do compose lines letter by letter,
as a linotype operator.
I do arrange words as is proper – mirror-like.
Even as all at the beginning –
the lead flour of the alphabet.
The printed sheet is hot, as fresh bread.
Yet each time, each time there remaineth a white spot,
and each time, each time someone doth inquire,
inkily appearing as a silhouette
through the paper. // I do think, the matter is in the stolen letter.
I do think, truly in it.
But I have lost it."
UP776_9,Iryna Shuvalova,2022.0,Ukrainian,post_2022,9,"9. лютий
---------

ми думали перейти цей лютий
як будь-який інший місяць –
хіба коротший

перейти як переходять маленьку річку
день у день 
з каменя на камінь

постояти перейшовши
на зеленому березі весни

натомість ця ріка реве й хапає нас за ноги
така червона пінява слизька
воістину люта

по коліно в мороці
ми похапцем риштуємо плоти
наші підкочені холоші

важніють
наливаються

може перемогою
може смертю

---------","9. February
--------- // We did think to pass this February
As any other month –
Save for its brevity. // To pass as one doth pass a little river
Day by day
From stone to stone. // To stand after having passed
On the green shore of spring. // Instead, this river doth roar and grasp us by the feet
So red, foamy, and slippery
Verily fierce. // Knee-deep in the murk
We do hastily fashion rafts
Our rolled-up trousers. // They grow weighty
They do fill. // Perhaps with victory
Perhaps with death."
UP776_4,Iryna Shuvalova,2022.0,Ukrainian,post_2022,8,"4. дерев‘яні боги
------------------

що ви знали мої дерев‘яні боги
мої хитромудрі золоті лисиці

коли мій літак
залишав під собою
сіре чорне руде
листопадове поле під борисполем
дзеркальні латки осінньої води

що ви бачили
зі своєї запилюженої
книжкової полиці коли я
приносила вам
шишки листочки камінці
дякуючи за

я думала
нову роботу
успішний переїзд
нарешті видану візу
а виявилося

за вечір у якому ніхто не стріляє
за місто в яке не в‘їжджають танки
за те що ця майже-вісімнадцятирічка

не мусить нікого вбивати
не мусить гинути

-------------------------","4. wooden gods
------------------ // What ye knew of mine wooden gods,
Mine cunning golden foxes. // When mine airplane
Did leave beneath itself
The grey black red
November field beneath Boryspil,
The mirror-like patches of autumn water. // What ye saw
From thine dusty
Bookshelf when I
Did bring to thee
Cones leaves stones,
Thanking for // I did think
Of a new job,
A successful move,
At last a issued visa,
And it hath turned out // For an evening in which no one doth shoot,
For a city into which tanks do not enter,
For that this almost eighteen-year-old // Must not kill anyone,
Must not perish. // -------------------------"
UP803_4,Kateryna Kalytko,2022.0,Ukrainian,post_2022,1,"Відбудувати означає довіритись.
Ось несу 
свій камінь, ось кладу
поруч твого. На чому вони триматимуться?
Світ – колоїдний розчин, первісний
бульйон із молекул
між двома етапами творення,
переназивання.
Наші стіни звиваються, рухаються, ніби
зводимо їх на спині великого змія.
Першим відбудувати дім твого сміху, прогрітий, освітлений,
легкість, свободу
підняти одразу цілком, прийняти
всього тебе у себе. І тому я стою,
тримаю щосили рухомі камені,
поки ти пішов 
по наступні.
#скляні_коліна","To rebuild doth mean to trust. Behold, I carry mine own stone, behold, I lay it beside thine. Upon what shall they rest? The world is a colloidal solution, a primordial broth of molecules between two stages of creation, renaming. Our walls do twist and move, as if we raise them upon the back of a great serpent. First, to rebuild the house of thy laughter, warmed, illuminated, to lift lightness and freedom all at once, to embrace all of thee within myself. And thus I stand, holding with all my might the moving stones, whilst thou hast gone for the next."
UP9_2,Oleksandr Irvanets,2014.0,Ukrainian,2014_2021,1,"А все ж таки в Європі, у Європоньці, 
Та трохи краще, ніж сидіти в копанці...","Yet all the same in Europe, in little Europe,  
'Tis somewhat better than to sit in a pit..."
UP909_1,Kateryna Kalytko,2022.0,Ukrainian,post_2022,8,"Нам потім перевинайти слова.
Ще цей кілок у грудях безіменний.
Та поки я лишаюся жива –
вичерпуй чорну силу просто з мене.

Каміння міст. Нічні тіла ракет.
І лють сурмить у кості серед хаосу.
І – смак води. І світло ще таке,
в якому притулявся і всміхався.

І помста вже дозріла до сівби.
Господь із дому виніс дві валізи. 
Любити, бути, вистояти, вбити.

Ми трохи поле. Трохи ближній ліс,
оця земля, з якої все росте,
уперта кров, що з рани зірве пластир
і потече рікою через степ – 
у море впасти.

Ми пам'ять. Але тут, де стоїмо,
нічого не лишається позаду.

Дивися – це любов. Я ще жива.
Це час, де все насправді називається.

Ось укриття в самому серці мови,
в яке ти зáйдеш.

#еней_не_озирається","We must thereafter re-invent words.  Yet this stake in my breast is nameless.  But whilst I remain alive –  exhaust the black strength straight from me. // Stones of cities. Nightly bodies of rockets.  And rage doth trumpet in the bones amidst chaos.  And – the taste of water. And light still so,  in which I did embrace and smile. // And vengeance hath ripened for sowing.  The Lord hath borne forth two suitcases from the house.  To love, to be, to endure, to kill. // We are somewhat field. Somewhat the nearby forest,  this land, from which all doth grow,  stubborn blood that shall tear the plaster from the wound  and flow as a river through the steppe –  to fall into the sea. // We are memory. But here, where we stand,  nothing doth remain behind. // Look – this is love. I am yet alive.  This is the time, where all is truly named. // Behold the shelter in the very heart of language,  into which thou shalt enter. // #eneas_doth_not_look_back"
UP936_1,Oleh Kotsarev,2022.0,Ukrainian,post_2022,4,"ОЧИЩЕННЯ

Кожного березня,
коли вітер
на гілках грає, мов на струнах,
у передмісті
чомусь підпалюють
поля і галявини.

Може, у пам’ять димчасту
про обряди спалювання
фігури зими
чи заради плодючості зайвої,
чи, зрештою, для очищення.
Так і цього разу.

На чорній траві перед лісом,
серед жовтих плантацій пшінки
шматочок лайна лежить,
вигорілий аж до білого
кольору,
а отже –
зовсім-зовсім очищений,
готовий
до нової весни.","Cleansing // Each March, when the wind doth play upon the branches, as upon strings, in the suburb, for some reason they do set fire to the fields and glades. // Mayhap, in the smoky memory of the rites of burning the figures of winter, or for the sake of excessive fertility, or, after all, for cleansing. Thus it is this time. // Upon the black grass before the forest, amidst the yellow plantations of amaranth, a piece of dung doth lie, burnt to white color, and thus – completely cleansed, ready for the new spring."
UP965_1,Maria Galina,2022.0,Ukrainian,post_2022,1,"Коли ми їхали, я взяла трошки  зайвих речей для мірного часу, наприклад шовковий піджак, щоб ходити літом на івенти, та улюблені буси. Книжок не взяла, бо важкеньки. Сподіваюся незважаючи на все,  що намисто ще буде куди надіти, тім  більше це бурштин, веніцийки та баламути
Ось за чим шкодую, забула улюблені джинси","When we did ride, I took a few superfluous things for peaceful times, forsooth a silken jacket, to walk in summer to events, and mine beloved beads. I took not books, for they be heavy. I do hope, despite all, that the necklace shall yet have a place to don, the more so as it be amber, venetians, and balamuts. Herein lies that which I do regret, I did forget mine beloved jeans."
__row_index_3342_1,Ihor Mitrov,2021.0,Ukrainian,2014_2021,2,"коли я виросту
стану провідником пасажирських вагонів
як батьки
уявіть собі
безплатно в потязі кататися
залазити на другу полицю
дивитися у вікно
гризти залізничний цукор
буду їздити в херсон
як мама
або в москву
як тато
уявіть собі
все життя
в потязі кататися
безплатно

2022","When I dost grow up, I shall become a conductor of passenger carriages, as my parents. Imagine thyself, riding for free upon the train, climbing to the second shelf, gazing out the window, gnawing on railway sugar. I shall travel to Kherson, as my mother, or to Moscow, as my father. Imagine thyself, all life long, riding upon the train for free."
__row_index_3381_1,Ihor Mitrov,2019.0,Ukrainian,2014_2021,3,"[жменя кільки]

графоманія це коли ти гуляєш лісовим
і дрон із шипунісом кажуть
мітруша ти ж охуєнний поет
напиши вірш про жменю кільки
а я ж охуєнний поет
я кажу да ок щас
і одразу в голові цілий образний ряд
у якому моє рідне місто
мій рідний дідусь
мій рідний батько
вони працювали на консервному заводі
вони годували кількою весь радянський союз
весь радянський союз жер кільку з керченського консервного заводу
мабуть тому він і розвалився
цей грьобаний радянський союз
мій дідусь помер
батька я не бачив п'ять років
як і рідне місто
а рука ставридкою бздить
ніби з колишньою
помирився

2019","[a handful of sprats] // Graphomania, 'tis when thou dost walk in the forest,
And a drone with a shypunis doth say,
""Mitrusha, thou art an amazing poet;
Write a verse about a handful of sprats.""
And I, an amazing poet,
Say, ""Yea, alright, I shall now.""
And straightaway in mine head, a whole array of images doth form,
In which mine native city,
Mine native grandfather,
Mine native father,
They did work at the cannery,
They did feed sprats to all the Soviet Union.
The whole Soviet Union did consume sprats from the Kerch cannery.
Perhaps that is why it did crumble,
This damned Soviet Union.
Mine grandfather hath passed away,
Mine father I have not seen for five years,
As well as mine native city.
And a hand doth fart like a horse mackerel,
As if reconciled with a former one. // 2019"
__row_index_3409_1,Ihor Mitrov,2018.0,Ukrainian,2014_2021,1,"коли сонце назавжди
сховається в надрах землі 
коли закиплять
востаннє
всі води й
охолонуть навіки
набувши твердої удачі
і заковзають ними
веселі комахи
з людськими очима
і залишать на кризі
слова невідомої мови
тоді я прокинуся
і розчахну всі фіранки
розписна
заморожена
гідрія","When the sun shall forever hide
In the bowels of the earth,
When all waters shall boil
For the last time,
And shall cool forever,
Gaining solid fortune,
And shall slide upon them
Merry insects
With human eyes,
And shall leave upon the ice
Words of an unknown tongue,
Then I shall awaken
And shall fling wide all curtains,
Painted,
Frozen,
Hydria."
__row_index_3428_1,Ihor Mitrov,2017.0,Ukrainian,2014_2021,12,"[касабланка]

у нас із тобою назавжди
залишиться наш париж
ми його були загубили
а минулої ночі знову
відшукали

минулої ночі 
коли твої вулиці 
кисло пахли опалими яблуками 
тепер усі яблука падають 
як солдати на верденському полі 
навіть недостиглі 
навіть зав’язки

лише одне надгризене 
висіло минулої ночі на прозорій гілці 
світило нам наче воля 
з уявленням

ми відповідно дивилися на нього 
воліючи 
і 
уявляючи 
яке воно на смак

ти казала
що воно на смак
як сніг з верхівки ай-петрі

я казав ні
воно смакує
караїмським чебуреком

ти засміялася 
а потім заплакала 
настав холодний осінній 
помірно-континентальний ранок

і якщо вночі 
ти була збуджена 
і пристрасно шепотіла мені на вухо 
українські пестливі слова 
то тепер стала суха 
ніби степовий вітер 
і російськомовна 
наче цинкова труна

цей келих за тебе крихітко 
у нас назавжди залишиться 
наш сімферополь

ти мусиш
сісти на цей корабель

2017","[casablanca] // In us with thee shall remain forever
Our Paris,
We had lost it,
Yet last night once more
We did find it. // Last night,
When thy streets
Did sourly smell of fallen apples,
Now all apples do fall
Like soldiers on Verdun's field,
Even unripe,
Even buds. // Only one gnawed
Did hang last night on a transparent branch,
It did shine for us as if freedom
With imagination. // We did gaze upon it accordingly,
Wishing
And
Imagining
What it might taste like. // Thou didst say
That it doth taste
Like snow from the peak of Ai-Petri. // I did say nay,
It doth taste
Like Karaim cheburek. // Thou didst laugh
And then didst weep,
A cold autumn
Moderately continental morn did arrive. // And if at night
Thou wert excited
And didst passionately whisper in mine ear
Ukrainian tender words,
Then now thou hast become dry
Like the steppe wind
And Russian-speaking
As if a zinc coffin. // This glass to thee, my little one,
Shall remain with us forever,
Our Simferopol. // Thou must
Sit upon this ship. // 2017"
